{
  "slug": "larranaga-mugica-pedro",
  "lang": "es",
  "path": "/es/personal/larranaga-mugica-pedro/",
  "name": "Larrañaga Múgica, Pedro",
  "wpId": 691,
  "date": "2017-05-26T11:37:04+00:00",
  "modified": "2024-01-13T15:51:21+00:00",
  "tags": [
    "catedraticos-de-universidad"
  ],
  "translations": {
    "en": "/en/personal/larranaga-mugica-pedro_en/",
    "es": "/es/personal/larranaga-mugica-pedro/"
  },
  "seo": {
    "title": "Larrañaga Múgica, Pedro - Máster Universitario en Inteligencia Artificial",
    "ogDescription": "Despacho: 2208Web: http://cig.fi.upm.es/CIGmembers/pedro-larranagaTeléfono: +34-91-336-7443ORCID: https://orcid.org/0000-0002-1885-4501Email: pedro.larranaga@fi.upm.esResearcherID: http://www.researcherid.com/rid/F-9293-2013Grupo de investigación: Grupo de Inteligencia ComputacionalScopus Author ID: https://www.scopus.com/authid/detail.uri?authorId=7004720416 Matemático por la Universidad […]",
    "image": {
      "src": "/wp-content/uploads/sites/6/2017/12/Pedro.jpg",
      "width": 176,
      "height": 220,
      "type": "image/jpeg"
    },
    "schemaImage": {
      "src": "/wp-content/uploads/sites/6/2017/05/Larranaga-MugicaPedro.png",
      "width": 490,
      "height": 489
    },
    "twitter": {
      "twitter:label1": "Tiempo de lectura",
      "twitter:data1": "3 minutos"
    }
  },
  "photo": {
    "src": "/wp-content/uploads/sites/6/2017/05/Larranaga-MugicaPedro.png"
  },
  "contact": [
    {
      "icon": "far fa-address-book",
      "label": "Despacho",
      "value": "2208"
    },
    {
      "icon": "far fa-file-word",
      "label": "Web",
      "value": "http://cig.fi.upm.es/CIGmembers/pedro-larranaga",
      "href": "http://cig.fi.upm.es/CIGmembers/pedro-larranaga",
      "target": "_blank",
      "itemNewTab": true
    },
    {
      "icon": "fas fa-phone-square",
      "label": "Teléfono",
      "value": "+34-91-336-7443"
    },
    {
      "icon": "far fa-address-card",
      "label": "ORCID",
      "value": "https://orcid.org/0000-0002-1885-4501",
      "href": "https://orcid.org/0000-0002-1885-4501",
      "target": "_blank",
      "itemNewTab": true
    },
    {
      "icon": "far fa-envelope",
      "label": "Email",
      "value": "pedro.larranaga@fi.upm.es",
      "href": "mailto:pedro.larranaga@fi.upm.es"
    },
    {
      "icon": "far fa-address-card",
      "label": "ResearcherID",
      "value": "http://www.researcherid.com/rid/F-9293-2013",
      "href": "http://www.researcherid.com/rid/F-9293-2013",
      "target": "_blank"
    },
    {
      "icon": "fas fa-users",
      "label": "Grupo de investigación",
      "value": "Grupo de Inteligencia Computacional",
      "href": "http://cig.fi.upm.es/",
      "iconColor": ""
    },
    {
      "icon": "far fa-address-card",
      "label": "Scopus Author ID",
      "value": "https://www.scopus.com/authid/detail.uri?authorId=7004720416",
      "href": "https://www.scopus.com/authid/detail.uri?authorId=7004720416",
      "target": "_blank",
      "itemNewTab": true,
      "iconColor": ""
    }
  ],
  "biography": [
    {
      "type": "html",
      "html": "<p></p>\n<p><!-- wp:paragraph --></p>\n<p>Matemático por la Universidad de Valladolid, Doctor en Informática (premio extraordinario) por la Universidad del País Vasco (UPV/EHU), en la que ocupó diversos puestos desde su incorporación en el año 1985. Desde el año 2004 es Catedrático de Universidad en el área de las Ciencias de la Computación e Inteligencia Artificial, puesto obtenido en las primeras habilitaciones nacionales celebradas. En el año 2007 se incorpora como Catedrático a la Universidad Politécnica de Madrid (UPM).</p>\n<p><!-- /wp:paragraph --> <!-- wp:paragraph --></p>\n<p>La actividad investigadora del profesor Larrañaga se desarrolla en el área del aprendizaje automático, los modelos gráficos probabilísticos y la computación evolutiva con aplicaciones en dominios biomédicos, bioinformáticos y de neurociencia. En dichos temas ha publicado más de 300 trabajos científicos, entre ellos es coautor de 6 libros (los dos últimos publicados este año por las editoriales CRC Press y Cambridge University Press), más de 160 artículos JCR y más de 70 capítulos de libro. Sus trabajos han recibido más de 6.400 citas según la Web of Science. Su índice&nbsp;<em>h</em>&nbsp;es 32 (Clarivate). Según Google Scholar, donde acumula un total de más de 18.500 citas (índice&nbsp;<em>h</em>=53). Un trabajo relativo a la detección de genes asociados al cáncer colorectal ha sido patentado con cobertura mundial, habiendo obtenido una patente de cobertura nacional para un kit de diagnóstico de cáncer de pulmón. Ha dirigido 26 tesis doctoral.</p>\n<p><!-- /wp:paragraph --> <!-- wp:paragraph --></p>\n<p>El profesor Larrañaga ha participado en más de 70 proyectos de investigación a nivel regional, nacional, e internacional. Ha participado entre otros en proyectos del plan nacional, Consolider-Ingenio, Cenit y en un proyecto del National Institutes of Health en colaboración con Harvad University. Actualmente participa en los Proyectos Cajal Blue Brain y Human Brain Project ambos de 10 años de duración en aspectos computacionales en neurociencia. Ha impartido charlas invitadas en prestigiosas universidades y centros de investigación tales como Harvad University, Massachusetts Institute of Technology, University of Utrech, Fraunhofer Institute, Pittsburgh University, Aalborg University, University of Economics in Praga, Nijmegen University, Essex University, y National University of Seoul. Ha impartido más de 17 charlas plenarias y 13 tutoriales en conferencias internacionales.</p>\n<p><!-- /wp:paragraph --> <!-- wp:paragraph --></p>\n<p>A nivel de gestión ha sido Secretario de la Facultad de Informática de la UPV/EHU en el periodo comprendido entre 1988 y 1991, Gestor del Plan Nacional en el área de Tecnologías Informáticas en el periodo 2007-2010, y miembro del comité asesor del área de Ingenierías de la Comunicación, Computación y Electrónica de la Comisión Nacional Evaluadora de la Actividad Investigadora (CNEAI) en el periodo 2010-2011. Colabora como experto con distintas agencias de evaluación europeas (Francia, Holanda, Austria, Israel, Bélgica, Portugal, Croacia). El profesor Larrañaga ha visto reconocida su actividad investigadora con el nombramiento, a nivel europeo, de ECCAI Fellow en 2012 y con el galardón de Premio Nacional de Informática Aritmel en 2013. En 2018 recibió el premio de la Asociación Española de Inteligencia Artificial por la labor desarrollada durante su carrera académica, y fue investido miembro de la Academia Europaea. Recientemente ha participado en el Grupo de Expertos que han redactado la Estrategia Española en I+D+I en Inteligencia Artificial.</p>\n<p><!-- /wp:paragraph --></p>\n<p></p>"
    }
  ],
  "listImage": {
    "src": "/wp-content/uploads/sites/6/2017/05/Larranaga-MugicaPedro.png",
    "width": 490,
    "height": 489,
    "alt": "",
    "srcset": "/wp-content/uploads/sites/6/2017/05/Larranaga-MugicaPedro.png 490w, /wp-content/uploads/sites/6/2017/05/Larranaga-MugicaPedro-300x300.png 300w, /wp-content/uploads/sites/6/2017/05/Larranaga-MugicaPedro-150x150.png 150w",
    "sizes": "(max-width: 490px) 100vw, 490px"
  }
}
