{
  "slug": "serrano-fernandez-emilio",
  "lang": "es",
  "path": "/es/personal/serrano-fernandez-emilio/",
  "name": "Serrano Fernández, Emilio",
  "wpId": 5590,
  "date": "2023-10-05T18:26:05+00:00",
  "modified": "2024-01-13T15:28:35+00:00",
  "tags": [
    "profesores-titulares-de-universidad"
  ],
  "translations": {
    "en": "/en/personal/serrano-fernandez-emilio_en/",
    "es": "/es/personal/serrano-fernandez-emilio/"
  },
  "seo": {
    "title": "Serrano Fernández, Emilio - Máster Universitario en Inteligencia Artificial",
    "ogDescription": "Despacho: 2201Web: http://emilioserra.oeg-upm.net/Teléfono: +34-91-067-2907ORCID: Email: emilioserra@fi.upm.esResearcherID: Grupo de investigación: Grupo de Ingeniería OntológicaScopus Author ID: https://www.scopus.com/authid/detail.uri?authorId=26634305600",
    "image": {
      "src": "/wp-content/uploads/sites/6/2021/06/EmilioS2018DIA_0.jpeg",
      "width": 176,
      "height": 220,
      "type": "image/jpeg"
    },
    "schemaImage": {
      "src": "/wp-content/uploads/sites/6/2023/10/Serrano-Emilio.jpg",
      "width": 539,
      "height": 538
    }
  },
  "photo": {
    "src": "/wp-content/uploads/sites/6/2023/10/Serrano-Emilio.jpg"
  },
  "contact": [
    {
      "icon": "far fa-address-book",
      "label": "Despacho",
      "value": "2201"
    },
    {
      "icon": "far fa-file-word",
      "label": "Web",
      "value": "http://emilioserra.oeg-upm.net/",
      "href": "http://emilioserra.oeg-upm.net/",
      "target": "_blank",
      "itemNewTab": true
    },
    {
      "icon": "fas fa-phone-square",
      "label": "Teléfono",
      "value": "+34-91-067-2907"
    },
    {
      "icon": "far fa-address-card",
      "label": "ORCID",
      "value": "",
      "itemNewTab": true
    },
    {
      "icon": "far fa-envelope",
      "label": "Email",
      "value": "emilioserra@fi.upm.es",
      "href": "mailto:emilioserra@fi.upm.es"
    },
    {
      "icon": "far fa-address-card",
      "label": "ResearcherID",
      "value": ""
    },
    {
      "icon": "fas fa-users",
      "label": "Grupo de investigación",
      "value": "Grupo de Ingeniería Ontológica",
      "href": "http://www.oeg-upm.net",
      "iconColor": ""
    },
    {
      "icon": "far fa-address-card",
      "label": "Scopus Author ID",
      "value": "https://www.scopus.com/authid/detail.uri?authorId=26634305600",
      "href": "https://www.scopus.com/authid/detail.uri?authorId=26634305600",
      "target": "_blank",
      "itemNewTab": true,
      "iconColor": ""
    }
  ],
  "biography": [
    {
      "type": "html",
      "html": "<p></p>"
    }
  ],
  "listImage": {
    "src": "/wp-content/uploads/sites/6/2023/10/Serrano-Emilio.jpg",
    "width": 539,
    "height": 538,
    "alt": "",
    "srcset": "/wp-content/uploads/sites/6/2023/10/Serrano-Emilio.jpg 539w, /wp-content/uploads/sites/6/2023/10/Serrano-Emilio-300x300.jpg 300w, /wp-content/uploads/sites/6/2023/10/Serrano-Emilio-150x150.jpg 150w",
    "sizes": "(max-width: 539px) 100vw, 539px"
  }
}
