{
  "slug": "hermegildo-salinas-manuel_en",
  "lang": "en",
  "path": "/en/personal/hermegildo-salinas-manuel_en/",
  "name": "Hermenegildo Salinas, Manuel",
  "wpId": 713,
  "date": "2017-05-26T11:33:07+00:00",
  "modified": "2024-01-13T03:03:14+00:00",
  "tags": [
    "professors"
  ],
  "translations": {
    "en": "/en/personal/hermegildo-salinas-manuel_en/",
    "es": "/es/personal/hermenegildo-salinas-manuel/"
  },
  "seo": {
    "title": "Hermenegildo Salinas, Manuel - Máster Universitario en Inteligencia Artificial",
    "image": {
      "src": "/wp-content/uploads/sites/6/2018/02/hermenegildo.jpg",
      "width": 176,
      "height": 220,
      "type": "image/jpeg"
    },
    "schemaImage": {
      "src": "/wp-content/uploads/sites/6/2017/05/Hermegildo-Salinas-Manuel.png",
      "width": 490,
      "height": 490
    }
  },
  "photo": {
    "src": "/wp-content/uploads/sites/6/2017/05/Hermegildo-Salinas-Manuel.png"
  },
  "contact": [
    {
      "icon": "far fa-address-book",
      "label": "Office",
      "value": "2212"
    },
    {
      "icon": "far fa-file-word",
      "label": "Web",
      "value": "http://www.clip.dia.fi.upm.es/~herme",
      "href": "http://www.clip.dia.fi.upm.es/~herme",
      "target": "_blank",
      "itemNewTab": true
    },
    {
      "icon": "fas fa-phone-square",
      "label": "Phone",
      "value": "+34-91-336-7435"
    },
    {
      "icon": "far fa-address-card",
      "label": "ORCID",
      "value": "https://orcid.org/0000-0002-7583-323X",
      "href": "https://orcid.org/0000-0002-7583-323X",
      "target": "_blank",
      "itemNewTab": true
    },
    {
      "icon": "far fa-envelope",
      "label": "Email",
      "value": "herme@fi.upm.es",
      "href": "mailto:herme@fi.upm.es"
    },
    {
      "icon": "far fa-address-card",
      "label": "ResearcherID",
      "value": "http://www.researcherid.com/rid/I-4418-2015",
      "href": "http://www.researcherid.com/rid/I-4418-2015",
      "target": "_blank"
    },
    {
      "icon": "fas fa-users",
      "label": "Research group",
      "value": "The Computational logic, Languages, Implementation, and Parallelism Laboratory",
      "href": "http://cliplab.org/",
      "iconColor": ""
    },
    {
      "icon": "far fa-address-card",
      "label": "Scopus Author ID",
      "value": "https://www.scopus.com/authid/detail.uri?authorId=7004271854",
      "href": "https://www.scopus.com/authid/detail.uri?authorId=7004271854",
      "target": "_blank",
      "itemNewTab": true,
      "iconColor": ""
    }
  ],
  "biography": [
    {
      "type": "html",
      "html": "<p></p>\n<p><!-- wp:paragraph --></p>\n<p><strong>Manuel Hermenegildo</strong>(Madrid 1959) es doctor en Ciencias de la Computación por la U. de Texas en Austin, EEUU (1986) y en Ing. de Telecomunicación por la UPM.Es Catedrático de Inteligencia Artificial de la UPM e Investigador Distinguido en el Instituto IMDEA Software, que dirigió desde su creación en 2007 hasta 2017, dedicado a la investigación en tecnologías de desarrollo software y ciberseguridad. Ha dirigido el nodo Español del KIC EIT Digital del Instituto Europeo de Innovación y Tecnología (2013-2107) y ocupó la Cátedra Príncipe de Asturias en Ciencia y Tecnología Informáticas en la U. of New Mexico, EEUU (2003-2008).</p>\n<p><!-- /wp:paragraph --> <!-- wp:paragraph --></p>\n<p>Ha sido también director de investigación en la Microelectronics and Computer Technology Corporation (1986-1989) y profesor en el Depto. de Informática de la U. of Texas at Austin (1987-1990).&nbsp;&nbsp;&nbsp;Es Premio Nacional de Investigación Julio Rey Pastor en Matemáticas y Tecnologías de la Información y las Comunicaciones, y Premio Nacional “Aritmel” en Informática. Es también miembro electo de la Academia Europaea, Presidente del Consejo Científico del Instituto Nacional Francés de Investigación en Informática y Automática (INRIA), y miembro del Consejo Científico del Instituto Leibniz Dagstuhl (Alemania).</p>\n<p><!-- /wp:paragraph --> <!-- wp:paragraph --></p>\n<p>Ha publicado más de 200 artículos científicos y es uno de los investigadores Españoles más citados en el área de la informática.Ha sido miembro del consejo científico del CSIC, del grupo asesor de alto nivel del programa de investigación en tecnologías para la sociedad de la información de la Comisión Europea (ISTAG), del consejo rector del CSIC y del CIEMAT, del consejo científico de Iberdrola, y del patronato de la Fundación Española para la Ciencia y la Tecnología, así como representante español en el Comité Asesor en Investigación de la Unión Europea (CREST), y Director General de Investigación en el Ministerio de Ciencia y Tecnología – MCYT (co-estableciendo programas como el Ramón y Cajal), entre otros cargos.</p>\n<p><!-- /wp:paragraph --></p>\n<p></p>"
    }
  ],
  "photoPrefixHtml": "&lt;",
  "listImage": {
    "src": "/wp-content/uploads/sites/6/2017/05/Hermegildo-Salinas-Manuel.png",
    "width": 490,
    "height": 490,
    "alt": "",
    "srcset": "/wp-content/uploads/sites/6/2017/05/Hermegildo-Salinas-Manuel.png 490w, /wp-content/uploads/sites/6/2017/05/Hermegildo-Salinas-Manuel-300x300.png 300w, /wp-content/uploads/sites/6/2017/05/Hermegildo-Salinas-Manuel-150x150.png 150w",
    "sizes": "(max-width: 490px) 100vw, 490px"
  },
  "styleVariant": "none"
}
