{
  "slug": "morales-caballero-jose-francisco",
  "lang": "es",
  "path": "/es/personal/morales-caballero-jose-francisco/",
  "name": "Morales Caballero, José Francisco",
  "wpId": 766,
  "date": "2022-04-25T07:00:48+00:00",
  "modified": "2024-05-20T02:48:53+00:00",
  "tags": [
    "profesores-permanentes-laborales"
  ],
  "translations": {
    "en": "/en/personal/morales-caballero-jose-francisco-2/",
    "es": "/es/personal/morales-caballero-jose-francisco/"
  },
  "seo": {
    "title": "Morales Caballero, José Francisco - Máster Universitario en Inteligencia Artificial",
    "ogDescription": "Despacho: 2201Web: Teléfono: +34-91-067-2285ORCID: Email: josefrancisco.morales@upm.esResearcherID: Grupo de investigación: Scopus Author ID:",
    "image": {
      "src": "/wp-content/uploads/sites/6/2023/10/Morales-Caballero.png",
      "width": 490,
      "height": 490,
      "type": "image/png"
    },
    "schemaImage": {
      "src": "/wp-content/uploads/sites/6/2023/10/Morales-Caballero.png",
      "width": 490,
      "height": 490
    }
  },
  "photo": {
    "src": "/wp-content/uploads/sites/6/2023/10/Morales-Caballero.png"
  },
  "contact": [
    {
      "icon": "far fa-address-book",
      "label": "Despacho",
      "value": "2201"
    },
    {
      "icon": "far fa-file-word",
      "label": "Web",
      "value": "",
      "itemNewTab": true
    },
    {
      "icon": "fas fa-phone-square",
      "label": "Teléfono",
      "value": "+34-91-067-2285"
    },
    {
      "icon": "far fa-address-card",
      "label": "ORCID",
      "value": "",
      "itemNewTab": true
    },
    {
      "icon": "far fa-envelope",
      "label": "Email",
      "value": "josefrancisco.morales@upm.es",
      "href": "mailto:josefrancisco.morales@upm.es"
    },
    {
      "icon": "far fa-address-card",
      "label": "ResearcherID",
      "value": ""
    },
    {
      "icon": "fas fa-users",
      "label": "Grupo de investigación",
      "value": "",
      "iconColor": ""
    },
    {
      "icon": "far fa-address-card",
      "label": "Scopus Author ID",
      "value": "",
      "itemNewTab": true,
      "iconColor": ""
    }
  ],
  "biography": [
    {
      "type": "html",
      "html": "<p></p>"
    }
  ],
  "listImage": {
    "src": "/wp-content/uploads/sites/6/2023/10/Morales-Caballero.png",
    "width": 490,
    "height": 490,
    "alt": "",
    "srcset": "/wp-content/uploads/sites/6/2023/10/Morales-Caballero.png 490w, /wp-content/uploads/sites/6/2023/10/Morales-Caballero-300x300.png 300w, /wp-content/uploads/sites/6/2023/10/Morales-Caballero-150x150.png 150w",
    "sizes": "(max-width: 490px) 100vw, 490px"
  }
}
