{
  "slug": "martinez-orga-vicente",
  "lang": "es",
  "path": "/es/personal/martinez-orga-vicente/",
  "name": "Martínez Orga, Vicente",
  "wpId": 5589,
  "date": "2023-10-05T19:31:16+00:00",
  "modified": "2024-01-13T15:10:33+00:00",
  "tags": [
    "profesores-titulares-de-universidad"
  ],
  "translations": {
    "en": "/en/personal/marinez-orga-vicente_en/",
    "es": "/es/personal/martinez-orga-vicente/"
  },
  "seo": {
    "title": "Martínez Orga, Vicente - Máster Universitario en Inteligencia Artificial",
    "ogDescription": "Despacho: 2109Web: Teléfono: +34-91-067-2900ORCID: https://orcid.org/0000-0002-0389-5415Email: vicente.martinez@upm.esResearcherID: Grupo de investigación: Scopus Author ID: https://www.scopus.com/authid/detail.uri?authorId=56512560000",
    "image": {
      "src": "/wp-content/uploads/sites/6/2023/10/Martinez-Orga-Vicente.jpeg",
      "width": 214,
      "height": 267,
      "type": "image/jpeg"
    },
    "schemaImage": {
      "src": "/wp-content/uploads/sites/6/2023/10/martinez-orga-vicente.png",
      "width": 490,
      "height": 490
    }
  },
  "photo": {
    "src": "/wp-content/uploads/sites/6/2023/10/martinez-orga-vicente.png"
  },
  "contact": [
    {
      "icon": "far fa-address-book",
      "label": "Despacho",
      "value": "2109"
    },
    {
      "icon": "far fa-file-word",
      "label": "Web",
      "value": "",
      "itemNewTab": true
    },
    {
      "icon": "fas fa-phone-square",
      "label": "Teléfono",
      "value": "+34-91-067-2900"
    },
    {
      "icon": "far fa-address-card",
      "label": "ORCID",
      "value": "https://orcid.org/0000-0002-0389-5415",
      "href": "https://orcid.org/0000-0002-0389-5415",
      "target": "_blank",
      "itemNewTab": true
    },
    {
      "icon": "far fa-envelope",
      "label": "Email",
      "value": "vicente.martinez@upm.es",
      "href": "mailto:vicente.martinez@upm.es"
    },
    {
      "icon": "far fa-address-card",
      "label": "ResearcherID",
      "value": ""
    },
    {
      "icon": "fas fa-users",
      "label": "Grupo de investigación",
      "value": "",
      "iconColor": ""
    },
    {
      "icon": "far fa-address-card",
      "label": "Scopus Author ID",
      "value": "https://www.scopus.com/authid/detail.uri?authorId=56512560000",
      "href": "https://www.scopus.com/authid/detail.uri?authorId=56512560000",
      "target": "_blank",
      "itemNewTab": true,
      "iconColor": ""
    }
  ],
  "biography": [
    {
      "type": "html",
      "html": "<p></p>"
    }
  ],
  "listImage": {
    "src": "/wp-content/uploads/sites/6/2023/10/martinez-orga-vicente.png",
    "width": 490,
    "height": 490,
    "alt": "",
    "srcset": "/wp-content/uploads/sites/6/2023/10/martinez-orga-vicente.png 490w, /wp-content/uploads/sites/6/2023/10/martinez-orga-vicente-300x300.png 300w, /wp-content/uploads/sites/6/2023/10/martinez-orga-vicente-150x150.png 150w",
    "sizes": "(max-width: 490px) 100vw, 490px"
  }
}
