{
  "slug": "bojan-mihaljevic",
  "lang": "en",
  "path": "/en/personal/bojan-mihaljevic/",
  "name": "Bojan Mihaljevic",
  "wpId": 5551,
  "date": "2023-10-05T20:11:06+00:00",
  "modified": "2024-05-20T02:52:32+00:00",
  "tags": [
    "assistant-profesors"
  ],
  "translations": {
    "en": "/en/personal/bojan-mihaljevic/",
    "es": "/es/personal/bojan-mihaljevic-es/"
  },
  "seo": {
    "title": "Bojan Mihaljevic - Máster Universitario en Inteligencia Artificial",
    "image": {
      "src": "/wp-content/uploads/sites/6/2023/10/BojanMihaljevic.png",
      "width": 484,
      "height": 490,
      "type": "image/png"
    },
    "schemaImage": {
      "src": "/wp-content/uploads/sites/6/2023/10/BojanMihaljevic.png",
      "width": 484,
      "height": 490
    }
  },
  "photo": {
    "src": "/wp-content/uploads/sites/6/2023/10/BojanMihaljevic.png"
  },
  "contact": [
    {
      "icon": "far fa-address-book",
      "label": "Office",
      "value": ""
    },
    {
      "icon": "far fa-file-word",
      "label": "Web",
      "value": "",
      "itemNewTab": true
    },
    {
      "icon": "fas fa-phone-square",
      "label": "Phone",
      "value": ""
    },
    {
      "icon": "far fa-address-card",
      "label": "ORCID",
      "value": "",
      "itemNewTab": true
    },
    {
      "icon": "far fa-envelope",
      "label": "Email",
      "value": ""
    },
    {
      "icon": "far fa-address-card",
      "label": "ResearcherID",
      "value": ""
    },
    {
      "icon": "fas fa-users",
      "label": "Research group",
      "value": "",
      "iconColor": ""
    },
    {
      "icon": "far fa-address-card",
      "label": "Scopus Author ID",
      "value": "",
      "itemNewTab": true,
      "iconColor": ""
    }
  ],
  "biography": [
    {
      "type": "html",
      "html": "<p></p>"
    }
  ],
  "photoPrefixHtml": "&lt;",
  "listImage": {
    "src": "/wp-content/uploads/sites/6/2023/10/BojanMihaljevic.png",
    "width": 484,
    "height": 490,
    "alt": "",
    "srcset": "/wp-content/uploads/sites/6/2023/10/BojanMihaljevic.png 484w, /wp-content/uploads/sites/6/2023/10/BojanMihaljevic-296x300.png 296w",
    "sizes": "(max-width: 484px) 100vw, 484px"
  },
  "styleVariant": "variant-1"
}
