{
  "slug": "elena-montiel-ponsoda",
  "lang": "es",
  "path": "/es/personal/elena-montiel-ponsoda/",
  "name": "Montiel Ponsoda, Elena",
  "wpId": 5595,
  "date": "2019-05-25T09:06:22+00:00",
  "modified": "2024-01-13T15:12:20+00:00",
  "tags": [
    "profesores-titulares-de-universidad"
  ],
  "translations": {
    "en": "/en/personal/elena-montiel-ponsoda_en/",
    "es": "/es/personal/elena-montiel-ponsoda/"
  },
  "seo": {
    "title": "Montiel Ponsoda, Elena - Máster Universitario en Inteligencia Artificial",
    "ogDescription": "Despacho: 5217Web: http://mayor2.dia.fi.upm.es/oeg-upm/index.php/es/teachers/52Teléfono: +34-91-0673051ORCID: Email: emontiel@fi.upm.esResearcherID: Grupo de investigación: Grupo de Ingeniería OntológicaScopus Author ID:",
    "image": {
      "src": "/wp-content/uploads/sites/6/2019/05/MG_8893-bis_0.jpg",
      "width": 220,
      "height": 179,
      "type": "image/jpeg"
    },
    "schemaImage": {
      "src": "/wp-content/uploads/sites/6/2019/05/Montiel-Ponsada-Elena.png",
      "width": 490,
      "height": 490
    }
  },
  "photo": {
    "src": "/wp-content/uploads/sites/6/2019/05/Montiel-Ponsada-Elena.png"
  },
  "contact": [
    {
      "icon": "far fa-address-book",
      "label": "Despacho",
      "value": "5217"
    },
    {
      "icon": "far fa-file-word",
      "label": "Web",
      "value": "http://mayor2.dia.fi.upm.es/oeg-upm/index.php/es/teachers/52",
      "href": "http://mayor2.dia.fi.upm.es/oeg-upm/index.php/es/teachers/52",
      "target": "_blank",
      "itemNewTab": true
    },
    {
      "icon": "fas fa-phone-square",
      "label": "Teléfono",
      "value": "+34-91-0673051"
    },
    {
      "icon": "far fa-address-card",
      "label": "ORCID",
      "value": "",
      "itemNewTab": true
    },
    {
      "icon": "far fa-envelope",
      "label": "Email",
      "value": "emontiel@fi.upm.es",
      "href": "mailto:emontiel@fi.upm.es"
    },
    {
      "icon": "far fa-address-card",
      "label": "ResearcherID",
      "value": ""
    },
    {
      "icon": "fas fa-users",
      "label": "Grupo de investigación",
      "value": "Grupo de Ingeniería Ontológica",
      "href": "http://www.oeg-upm.net/",
      "iconColor": ""
    },
    {
      "icon": "far fa-address-card",
      "label": "Scopus Author ID",
      "value": "",
      "itemNewTab": true,
      "iconColor": ""
    }
  ],
  "biography": [
    {
      "type": "html",
      "html": "<p></p>"
    }
  ],
  "listImage": {
    "src": "/wp-content/uploads/sites/6/2019/05/Montiel-Ponsada-Elena.png",
    "width": 490,
    "height": 490,
    "alt": "",
    "srcset": "/wp-content/uploads/sites/6/2019/05/Montiel-Ponsada-Elena.png 490w, /wp-content/uploads/sites/6/2019/05/Montiel-Ponsada-Elena-300x300.png 300w, /wp-content/uploads/sites/6/2019/05/Montiel-Ponsada-Elena-150x150.png 150w",
    "sizes": "(max-width: 490px) 100vw, 490px"
  }
}
