{
  "slug": "rodriguez-paton-aradas-alfonso_en",
  "lang": "en",
  "path": "/en/personal/rodriguez-paton-aradas-alfonso_en/",
  "name": "Rodríguez-Patón Aradas, Alfonso",
  "wpId": 731,
  "date": "2017-05-26T16:24:40+00:00",
  "modified": "2024-01-13T03:08:04+00:00",
  "tags": [
    "professors"
  ],
  "translations": {
    "en": "/en/personal/rodriguez-paton-aradas-alfonso_en/",
    "es": "/es/personal/rodriguez-paton-aradas-alfonso/"
  },
  "seo": {
    "title": "Rodríguez-Patón Aradas, Alfonso - Máster Universitario en Inteligencia Artificial",
    "image": {
      "src": "/wp-content/uploads/sites/6/2017/05/alfonsorp.jpg",
      "width": 176,
      "height": 220,
      "type": "image/jpeg"
    },
    "schemaImage": {
      "src": "/wp-content/uploads/sites/6/2017/05/Rodriguez-Paton-Aradas-Alfonso.png",
      "width": 490,
      "height": 490
    }
  },
  "photo": {
    "src": "/wp-content/uploads/sites/6/2017/05/Rodriguez-Paton-Aradas-Alfonso.png"
  },
  "contact": [
    {
      "icon": "far fa-address-book",
      "label": "Office",
      "value": "2106"
    },
    {
      "icon": "far fa-file-word",
      "label": "Web",
      "value": "",
      "itemNewTab": true
    },
    {
      "icon": "fas fa-phone-square",
      "label": "Phone",
      "value": "+34-91-336-6604"
    },
    {
      "icon": "far fa-address-card",
      "label": "ORCID",
      "value": "https://orcid.org/0000-0001-7289-2114",
      "href": "https://orcid.org/0000-0001-7289-2114",
      "target": "_blank",
      "itemNewTab": true
    },
    {
      "icon": "far fa-envelope",
      "label": "Email",
      "value": "arpaton@fi.upm.es",
      "href": "mailto:arpaton@fi.upm.es"
    },
    {
      "icon": "far fa-address-card",
      "label": "ResearcherID",
      "value": ""
    },
    {
      "icon": "fas fa-users",
      "label": "Research group",
      "value": "Laboratorio de Inteligencia Artificial",
      "href": "http://www.lia.upm.es/",
      "iconColor": ""
    },
    {
      "icon": "far fa-address-card",
      "label": "Scopus Author ID",
      "value": "https://www.scopus.com/authid/detail.uri?authorId=8882795400",
      "href": "https://www.scopus.com/authid/detail.uri?authorId=8882795400",
      "target": "_blank",
      "itemNewTab": true,
      "iconColor": ""
    }
  ],
  "biography": [
    {
      "type": "html",
      "html": "<p></p>"
    }
  ],
  "photoPrefixHtml": "&lt;",
  "listImage": {
    "src": "/wp-content/uploads/sites/6/2017/05/Rodriguez-Paton-Aradas-Alfonso.png",
    "width": 490,
    "height": 490,
    "alt": "",
    "srcset": "/wp-content/uploads/sites/6/2017/05/Rodriguez-Paton-Aradas-Alfonso.png 490w, /wp-content/uploads/sites/6/2017/05/Rodriguez-Paton-Aradas-Alfonso-300x300.png 300w, /wp-content/uploads/sites/6/2017/05/Rodriguez-Paton-Aradas-Alfonso-150x150.png 150w",
    "sizes": "(max-width: 490px) 100vw, 490px"
  },
  "styleVariant": "variant-1"
}
