{
  "slug": "fernandez-del-pozo-juan-antonio-en",
  "lang": "en",
  "path": "/en/personal/fernandez-del-pozo-juan-antonio-en/",
  "name": "Fernández del Pozo, Juan Antonio",
  "wpId": 738,
  "date": "2018-05-21T07:09:23+00:00",
  "modified": "2024-01-13T03:16:16+00:00",
  "tags": [
    "assistant-professors"
  ],
  "translations": {
    "en": "/en/personal/fernandez-del-pozo-juan-antonio-en/",
    "es": "/es/personal/fernandez-del-pozo-juan-antonio/"
  },
  "seo": {
    "title": "Fernández del Pozo, Juan Antonio - Máster Universitario en Inteligencia Artificial",
    "image": {
      "src": "/wp-content/uploads/sites/6/2018/05/juanantonio_0.jpg",
      "width": 176,
      "height": 220,
      "type": "image/jpeg"
    },
    "schemaImage": {
      "src": "/wp-content/uploads/sites/6/2018/05/fernandez-pozo-jose-antonio.png",
      "width": 490,
      "height": 490
    }
  },
  "photo": {
    "src": "/wp-content/uploads/sites/6/2018/05/fernandez-pozo-jose-antonio.png"
  },
  "contact": [
    {
      "icon": "far fa-address-book",
      "label": "Office",
      "value": "2101"
    },
    {
      "icon": "far fa-file-word",
      "label": "Web",
      "value": "https://dia.fi.upm.es/~jafernan/Jafernandez.htm",
      "href": "https://dia.fi.upm.es/~jafernan/Jafernandez.htm",
      "target": "_blank",
      "itemNewTab": true
    },
    {
      "icon": "fas fa-phone-square",
      "label": "Phone",
      "value": "+34-91-067-2888"
    },
    {
      "icon": "far fa-address-card",
      "label": "ORCID",
      "value": "https://orcid.org/0000-0002-7714-4657",
      "href": "https://orcid.org/0000-0002-7714-4657",
      "target": "_blank",
      "itemNewTab": true
    },
    {
      "icon": "far fa-envelope",
      "label": "Email",
      "value": "jafernandez@fi.upm.es",
      "href": "mailto:jafernandez@fi.upm.es"
    },
    {
      "icon": "far fa-address-card",
      "label": "ResearcherID",
      "value": ""
    },
    {
      "icon": "fas fa-users",
      "label": "Research group",
      "value": "Grupo de Inteligencia Computacional",
      "href": "http://cig.fi.upm.es",
      "iconColor": ""
    },
    {
      "icon": "far fa-address-card",
      "label": "Scopus Author ID",
      "value": "",
      "itemNewTab": true,
      "iconColor": ""
    }
  ],
  "biography": [
    {
      "type": "html",
      "html": "<p></p>"
    }
  ],
  "photoPrefixHtml": "&lt;",
  "listImage": {
    "src": "/wp-content/uploads/sites/6/2018/05/fernandez-pozo-jose-antonio.png",
    "width": 490,
    "height": 490,
    "alt": "",
    "srcset": "/wp-content/uploads/sites/6/2018/05/fernandez-pozo-jose-antonio.png 490w, /wp-content/uploads/sites/6/2018/05/fernandez-pozo-jose-antonio-300x300.png 300w, /wp-content/uploads/sites/6/2018/05/fernandez-pozo-jose-antonio-150x150.png 150w",
    "sizes": "(max-width: 490px) 100vw, 490px"
  },
  "styleVariant": "variant-1"
}
