{
  "slug": "melgar-garcia-laura",
  "lang": "en",
  "path": "/en/personal/melgar-garcia-laura/",
  "name": "Melgar García, Laura",
  "wpId": 8095,
  "date": "2024-07-10T09:37:19+00:00",
  "modified": "2024-07-10T09:47:38+00:00",
  "tags": [
    "lecturers"
  ],
  "translations": {},
  "seo": {
    "title": "Melgar García, Laura - Máster Universitario en Inteligencia Artificial",
    "image": {
      "src": "/wp-content/uploads/sites/6/2024/07/Laura-Melgar-Garcia.jpg",
      "width": 512,
      "height": 512,
      "type": "image/jpeg"
    },
    "schemaImage": {
      "src": "/wp-content/uploads/sites/6/2024/07/Laura-Melgar-Garcia.jpg",
      "width": 512,
      "height": 512
    },
    "twitter": {
      "twitter:label1": "Est. reading time",
      "twitter:data1": "1 minute"
    }
  },
  "photo": {
    "src": "/wp-content/uploads/sites/6/2024/07/Laura-Melgar-Garcia.jpg"
  },
  "contact": [
    {
      "icon": "far fa-address-book",
      "label": "Office",
      "value": "3205"
    },
    {
      "icon": "far fa-file-word",
      "label": "Web",
      "value": "",
      "itemNewTab": true
    },
    {
      "icon": "fas fa-phone-square",
      "label": "Phone",
      "value": "910672917"
    },
    {
      "icon": "far fa-address-card",
      "label": "ORCID",
      "value": "https://orcid.org/0000-0001-7609-0450",
      "href": "https://orcid.org/0000-0001-7609-0450",
      "target": "_blank",
      "itemNewTab": true
    },
    {
      "icon": "far fa-envelope",
      "label": "Email",
      "value": "laura.melgar@upm.es",
      "href": "mailto:laura.melgar@upm.es"
    },
    {
      "icon": "far fa-address-card",
      "label": "ResearcherID",
      "value": "https://www.researchid.co/rid79892",
      "href": "https://www.researchid.co/rid79892",
      "target": "_blank"
    },
    {
      "icon": "fas fa-users",
      "label": "Research group",
      "value": "Ontology Engineering Group",
      "href": "https://oeg.fi.upm.es/",
      "iconColor": ""
    },
    {
      "icon": "far fa-address-card",
      "label": "Scopus Author ID",
      "value": "https://www.scopus.com/authid/detail.uri?authorId=57216289749",
      "href": "https://www.scopus.com/authid/detail.uri?authorId=57216289749",
      "target": "_blank",
      "itemNewTab": true,
      "iconColor": ""
    }
  ],
  "biography": [
    {
      "type": "html",
      "html": "<p></p>"
    }
  ],
  "photoPrefixHtml": "&lt;",
  "listImage": {
    "src": "/wp-content/uploads/sites/6/2024/07/Laura-Melgar-Garcia.jpg",
    "width": 512,
    "height": 512,
    "alt": "",
    "srcset": "/wp-content/uploads/sites/6/2024/07/Laura-Melgar-Garcia.jpg 512w, /wp-content/uploads/sites/6/2024/07/Laura-Melgar-Garcia-300x300.jpg 300w, /wp-content/uploads/sites/6/2024/07/Laura-Melgar-Garcia-150x150.jpg 150w",
    "sizes": "(max-width: 512px) 100vw, 512px"
  },
  "styleVariant": "none"
}
